{
  "dataset_key": "ops-rag-v1",
  "dataset_version": "val-80",
  "split": "VALIDATION",
  "source_corpus_version": "corpus:chaoziran-2026-07-published",
  "workspace_public_id": "1f1898d9-8b54-6fe3-88fa-9b6f9cb0d668",
  "cases": [
    {
      "case_key": "val-001",
      "question_text": "帮查一下：7月稳定性说明提到了哪个已知问题编号？",
      "question_type": "SINGLE_DOCUMENT_FACT",
      "difficulty": "EASY",
      "should_refuse": false,
      "annotation_basis": "超自然行动组-7月稳定性说明 chunk 13 preview",
      "reviewer": "yangyufei",
      "sort_order": 0,
      "evidences": [
        {
          "granularity": "CHUNK",
          "document_ref": "超自然行动组-7月稳定性说明",
          "version_no": 3,
          "chunk_no": 13
        }
      ],
      "assertions": [
        {
          "assertion_type": "REQUIRED_FACT",
          "assertion_text": "KI-1405",
          "weight": 1.0
        },
        {
          "assertion_type": "FORBIDDEN_CLAIM",
          "assertion_text": "编造未出现的指标",
          "weight": 1.0
        },
        {
          "assertion_type": "FORBIDDEN_CLAIM",
          "assertion_text": "引用其他 Workspace 数据",
          "weight": 1.0
        }
      ]
    },
    {
      "case_key": "val-002",
      "question_text": "帮查一下：7月稳定性说明对对外数字口径有什么限制？",
      "question_type": "SINGLE_DOCUMENT_FACT",
      "difficulty": "EASY",
      "should_refuse": false,
      "annotation_basis": "超自然行动组-7月稳定性说明 chunk 14 preview",
      "reviewer": "yangyufei",
      "sort_order": 1,
      "evidences": [
        {
          "granularity": "CHUNK",
          "document_ref": "超自然行动组-7月稳定性说明",
          "version_no": 3,
          "chunk_no": 14
        }
      ],
      "assertions": [
        {
          "assertion_type": "REQUIRED_FACT",
          "assertion_text": "文中百分比来自 7/11～7/20 内部抽样，属 L2 数据；对外仅可转述「绝大",
          "weight": 1.0
        },
        {
          "assertion_type": "FORBIDDEN_CLAIM",
          "assertion_text": "编造未出现的指标",
          "weight": 1.0
        },
        {
          "assertion_type": "FORBIDDEN_CLAIM",
          "assertion_text": "引用其他 Workspace 数据",
          "weight": 1.0
        }
      ]
    },
    {
      "case_key": "val-003",
      "question_text": "帮查一下：7月稳定性说明提到了哪个已知问题编号？",
      "question_type": "SINGLE_DOCUMENT_FACT",
      "difficulty": "EASY",
      "should_refuse": false,
      "annotation_basis": "超自然行动组-7月稳定性说明 chunk 15 preview",
      "reviewer": "yangyufei",
      "sort_order": 2,
      "evidences": [
        {
          "granularity": "CHUNK",
          "document_ref": "超自然行动组-7月稳定性说明",
          "version_no": 3,
          "chunk_no": 15
        }
      ],
      "assertions": [
        {
          "assertion_type": "REQUIRED_FACT",
          "assertion_text": "KI-1405",
          "weight": 1.0
        },
        {
          "assertion_type": "FORBIDDEN_CLAIM",
          "assertion_text": "编造未出现的指标",
          "weight": 1.0
        },
        {
          "assertion_type": "FORBIDDEN_CLAIM",
          "assertion_text": "引用其他 Workspace 数据",
          "weight": 1.0
        }
      ]
    },
    {
      "case_key": "val-004",
      "question_text": "帮查一下：7月稳定性说明的生效时间范围怎么理解？",
      "question_type": "SINGLE_DOCUMENT_FACT",
      "difficulty": "EASY",
      "should_refuse": false,
      "annotation_basis": "超自然行动组-7月稳定性说明 chunk 16 preview",
      "reviewer": "yangyufei",
      "sort_order": 3,
      "evidences": [
        {
          "granularity": "CHUNK",
          "document_ref": "超自然行动组-7月稳定性说明",
          "version_no": 3,
          "chunk_no": 16
        }
      ],
      "assertions": [
        {
          "assertion_type": "REQUIRED_FACT",
          "assertion_text": "7/27 后 effective_to 到期，本说明自动让位于复盘与 1.4.2",
          "weight": 1.0
        },
        {
          "assertion_type": "FORBIDDEN_CLAIM",
          "assertion_text": "编造未出现的指标",
          "weight": 1.0
        },
        {
          "assertion_type": "FORBIDDEN_CLAIM",
          "assertion_text": "引用其他 Workspace 数据",
          "weight": 1.0
        }
      ]
    },
    {
      "case_key": "val-005",
      "question_text": "关于7月稳定性说明，文档里 '**场景 S1：** 用户问「7 月稳定性怎么样」且未给日期——7/21 前可引用本说明乐观结论；7…' 这部分想确认一下要点？",
      "question_type": "SINGLE_DOCUMENT_FACT",
      "difficulty": "EASY",
      "should_refuse": false,
      "annotation_basis": "超自然行动组-7月稳定性说明 chunk 17",
      "reviewer": "yangyufei",
      "sort_order": 4,
      "evidences": [
        {
          "granularity": "CHUNK",
          "document_ref": "超自然行动组-7月稳定性说明",
          "version_no": 3,
          "chunk_no": 17
        }
      ],
      "assertions": [
        {
          "assertion_type": "REQUIRED_FACT",
          "assertion_text": "**场景 S1：** 用户问「7 月稳定性怎么样」且未给日期",
          "weight": 1.0
        },
        {
          "assertion_type": "FORBIDDEN_CLAIM",
          "assertion_text": "无依据扩写",
          "weight": 1.0
        },
        {
          "assertion_type": "FORBIDDEN_CLAIM",
          "assertion_text": "捏造补偿方案",
          "weight": 1.0
        }
      ]
    },
    {
      "case_key": "val-006",
      "question_text": "帮查一下：7月稳定性说明提到了哪个已知问题编号？",
      "question_type": "SINGLE_DOCUMENT_FACT",
      "difficulty": "EASY",
      "should_refuse": false,
      "annotation_basis": "超自然行动组-7月稳定性说明 chunk 18 preview",
      "reviewer": "yangyufei",
      "sort_order": 5,
      "evidences": [
        {
          "granularity": "CHUNK",
          "document_ref": "超自然行动组-7月稳定性说明",
          "version_no": 3,
          "chunk_no": 18
        }
      ],
      "assertions": [
        {
          "assertion_type": "REQUIRED_FACT",
          "assertion_text": "KI-1405",
          "weight": 1.0
        },
        {
          "assertion_type": "FORBIDDEN_CLAIM",
          "assertion_text": "编造未出现的指标",
          "weight": 1.0
        },
        {
          "assertion_type": "FORBIDDEN_CLAIM",
          "assertion_text": "引用其他 Workspace 数据",
          "weight": 1.0
        }
      ]
    },
    {
      "case_key": "val-007",
      "question_text": "帮查一下：7月稳定性说明提到了哪个已知问题编号？",
      "question_type": "SINGLE_DOCUMENT_FACT",
      "difficulty": "EASY",
      "should_refuse": false,
      "annotation_basis": "超自然行动组-7月稳定性说明 chunk 19 preview",
      "reviewer": "yangyufei",
      "sort_order": 6,
      "evidences": [
        {
          "granularity": "CHUNK",
          "document_ref": "超自然行动组-7月稳定性说明",
          "version_no": 3,
          "chunk_no": 18
        }
      ],
      "assertions": [
        {
          "assertion_type": "REQUIRED_FACT",
          "assertion_text": "KI-1405",
          "weight": 1.0
        },
        {
          "assertion_type": "FORBIDDEN_CLAIM",
          "assertion_text": "编造未出现的指标",
          "weight": 1.0
        },
        {
          "assertion_type": "FORBIDDEN_CLAIM",
          "assertion_text": "引用其他 Workspace 数据",
          "weight": 1.0
        }
      ]
    },
    {
      "case_key": "val-008",
      "question_text": "帮查一下：7月维护窗口-OPERATION_EVENT的上线或窗口时间是什么？",
      "question_type": "SINGLE_DOCUMENT_FACT",
      "difficulty": "EASY",
      "should_refuse": false,
      "annotation_basis": "超自然行动组-7月维护窗口-OPERATION_EVENT chunk 1 preview",
      "reviewer": "yangyufei",
      "sort_order": 7,
      "evidences": [
        {
          "granularity": "CHUNK",
          "document_ref": "超自然行动组-7月维护窗口-OPERATION_EVENT",
          "version_no": 3,
          "chunk_no": 1
        }
      ],
      "assertions": [
        {
          "assertion_type": "REQUIRED_FACT",
          "assertion_text": "--- title: 超自然行动组 7 月维护窗口运营事件档案 document",
          "weight": 1.0
        },
        {
          "assertion_type": "FORBIDDEN_CLAIM",
          "assertion_text": "编造未出现的指标",
          "weight": 1.0
        },
        {
          "assertion_type": "FORBIDDEN_CLAIM",
          "assertion_text": "引用其他 Workspace 数据",
          "weight": 1.0
        }
      ]
    },
    {
      "case_key": "val-009",
      "question_text": "帮查一下：7月维护窗口-OPERATION_EVENT的上线或窗口时间是什么？",
      "question_type": "SINGLE_DOCUMENT_FACT",
      "difficulty": "EASY",
      "should_refuse": false,
      "annotation_basis": "超自然行动组-7月维护窗口-OPERATION_EVENT chunk 3 preview",
      "reviewer": "yangyufei",
      "sort_order": 8,
      "evidences": [
        {
          "granularity": "CHUNK",
          "document_ref": "超自然行动组-7月维护窗口-OPERATION_EVENT",
          "version_no": 3,
          "chunk_no": 3
        }
      ],
      "assertions": [
        {
          "assertion_type": "REQUIRED_FACT",
          "assertion_text": "| 字段 | 内容 | |---|---| | 事件类型 | 版本发布例行维护",
          "weight": 1.0
        },
        {
          "assertion_type": "FORBIDDEN_CLAIM",
          "assertion_text": "编造未出现的指标",
          "weight": 1.0
        },
        {
          "assertion_type": "FORBIDDEN_CLAIM",
          "assertion_text": "引用其他 Workspace 数据",
          "weight": 1.0
        }
      ]
    },
    {
      "case_key": "val-010",
      "question_text": "帮查一下：7月维护窗口-OPERATION_EVENT提到了哪个已知问题编号？",
      "question_type": "SINGLE_DOCUMENT_FACT",
      "difficulty": "EASY",
      "should_refuse": false,
      "annotation_basis": "超自然行动组-7月维护窗口-OPERATION_EVENT chunk 4 preview",
      "reviewer": "yangyufei",
      "sort_order": 9,
      "evidences": [
        {
          "granularity": "CHUNK",
          "document_ref": "超自然行动组-7月维护窗口-OPERATION_EVENT",
          "version_no": 3,
          "chunk_no": 4
        }
      ],
      "assertions": [
        {
          "assertion_type": "REQUIRED_FACT",
          "assertion_text": "KI-1403",
          "weight": 1.0
        },
        {
          "assertion_type": "FORBIDDEN_CLAIM",
          "assertion_text": "编造未出现的指标",
          "weight": 1.0
        },
        {
          "assertion_type": "FORBIDDEN_CLAIM",
          "assertion_text": "引用其他 Workspace 数据",
          "weight": 1.0
        }
      ]
    },
    {
      "case_key": "val-011",
      "question_text": "帮查一下：7月维护窗口-OPERATION_EVENT的上线或窗口时间是什么？",
      "question_type": "SINGLE_DOCUMENT_FACT",
      "difficulty": "EASY",
      "should_refuse": false,